{
  "artifact_name": "controller-benchmark-compiler-coverage-trust-receipt-v0",
  "generated_on": "2026-04-02T15:58:03.657407+00:00",
  "script_path": "repo:/programs/partial-reprogramming-controller/scripts/controller_phase_stratified_compile_condition_records.py",
  "inputs": {
    "study_corpus": "repo:/programs/partial-reprogramming-controller/benchmarks/phase-stratified-controller-benchmark-v0/controller-benchmark-study-corpus-v0.csv",
    "negative_families": "repo:/programs/partial-reprogramming-controller/benchmarks/phase-stratified-controller-benchmark-v0/controller-benchmark-negative-family-registry-v0.json",
    "conditions": "repo:/programs/partial-reprogramming-controller/benchmarks/phase-stratified-controller-benchmark-v0/controller-benchmark-condition-fixture-v0.jsonl",
    "compiler_rules_dir": "repo:/programs/partial-reprogramming-controller/benchmarks/phase-stratified-controller-benchmark-v0/compiler-rules"
  },
  "outputs": {
    "condition_records": "repo:/programs/partial-reprogramming-controller/benchmarks/phase-stratified-controller-benchmark-v0/controller-benchmark-condition-records-v0.jsonl",
    "coverage_trust_receipt": "repo:/programs/partial-reprogramming-controller/benchmarks/phase-stratified-controller-benchmark-v0/controller-benchmark-compiler-coverage-trust-receipt-v0.json"
  },
  "condition_count": 8,
  "source_kind_counts": {
    "study_specific_rule": 8
  },
  "rule_backed_condition_count": 8,
  "fixture_backed_condition_count": 0,
  "rule_backed_condition_ids": [
    "VITA_CTRL_001",
    "VITA_CTRL_002",
    "VITA_CTRL_003",
    "VITA_CTRL_004",
    "VITA_CTRL_008",
    "VITA_CTRL_005",
    "VITA_CTRL_006",
    "VITA_CTRL_007"
  ],
  "fixture_backed_condition_ids": [],
  "common_bounded_manual_judgment_fields": [
    "phase_layer",
    "evidence_modes_present",
    "age_signal_score",
    "identity_pressure_level",
    "risk_pressure_level",
    "active_negative_family_ids",
    "condition_summary"
  ],
  "common_derived_fields": [
    "primary_evidence_class",
    "supporting_evidence_classes",
    "age_signal_status",
    "identity_status",
    "risk_status",
    "negative_family_roles",
    "negative_family_tiers",
    "source_trace",
    "provenance"
  ],
  "common_matrix_extracted_fields": [],
  "trust_boundary_claim": "All benchmark condition records now preserve explicit source trace. Study-specific rules mean the benchmark no longer depends on the global fixture for migrated families, but key decision fields remain bounded human judgments encoded in machine-readable rule packs rather than direct matrix-derived extraction.",
  "coverage_verdict": "all_live_conditions_rule_backed",
  "condition_rows": [
    {
      "condition_id": "VITA_CTRL_001",
      "study_family_id": "sarkar_2020",
      "source_kind": "study_specific_rule",
      "trust_status": "rule_backed_with_bounded_manual_judgment",
      "traceable_support": {
        "study_family_id": "sarkar_2020",
        "accession_bundle": "GSE142439;PRJNA598923",
        "derived_from": [
          "repo:/programs/partial-reprogramming-controller/benchmarks/phase-stratified-controller-benchmark-v0/compiler-rules/sarkar_2020-v0.json",
          "repo:/programs/partial-reprogramming-controller/benchmarks/phase-stratified-controller-benchmark-v0/controller-benchmark-study-corpus-v0.csv",
          "repo:/programs/partial-reprogramming-controller/benchmarks/phase-stratified-controller-benchmark-v0/controller-benchmark-negative-family-registry-v0.json"
        ]
      },
      "bounded_manual_judgment_fields": [
        "phase_layer",
        "evidence_modes_present",
        "age_signal_score",
        "identity_pressure_level",
        "risk_pressure_level",
        "active_negative_family_ids",
        "condition_summary"
      ],
      "derived_fields": [
        "primary_evidence_class",
        "supporting_evidence_classes",
        "age_signal_status",
        "identity_status",
        "risk_status",
        "negative_family_roles",
        "negative_family_tiers",
        "source_trace",
        "provenance"
      ],
      "matrix_extracted_fields": [],
      "compiler_trust_notes": [
        "This condition is now carried by a dedicated study-specific rule pack rather than the global fixture.",
        "The benchmark decision fields remain bounded human judgments encoded in the rule pack rather than direct matrix-derived extraction outputs."
      ],
      "condition_summary": "Sarkar initiation-only bulk condition used as early age-movement context without heterogeneity resolution."
    },
    {
      "condition_id": "VITA_CTRL_002",
      "study_family_id": "roux_2022_sc",
      "source_kind": "study_specific_rule",
      "trust_status": "rule_backed_with_bounded_manual_judgment",
      "traceable_support": {
        "study_family_id": "roux_2022_sc",
        "accession_bundle": "GSE176206",
        "derived_from": [
          "repo:/programs/partial-reprogramming-controller/benchmarks/phase-stratified-controller-benchmark-v0/compiler-rules/roux_2022_sc-v0.json",
          "repo:/programs/partial-reprogramming-controller/benchmarks/phase-stratified-controller-benchmark-v0/controller-benchmark-study-corpus-v0.csv",
          "repo:/programs/partial-reprogramming-controller/benchmarks/phase-stratified-controller-benchmark-v0/controller-benchmark-negative-family-registry-v0.json"
        ]
      },
      "bounded_manual_judgment_fields": [
        "phase_layer",
        "evidence_modes_present",
        "age_signal_score",
        "identity_pressure_level",
        "risk_pressure_level",
        "active_negative_family_ids",
        "condition_summary"
      ],
      "derived_fields": [
        "primary_evidence_class",
        "supporting_evidence_classes",
        "age_signal_status",
        "identity_status",
        "risk_status",
        "negative_family_roles",
        "negative_family_tiers",
        "source_trace",
        "provenance"
      ],
      "matrix_extracted_fields": [],
      "compiler_trust_notes": [
        "This condition is now carried by a dedicated study-specific rule pack rather than the global fixture.",
        "The benchmark decision fields remain bounded human judgments encoded in the rule pack rather than direct matrix-derived extraction outputs."
      ],
      "condition_summary": "Roux day-6 single-cell initiation snapshot with youthful movement entangled with identity suppression."
    },
    {
      "condition_id": "VITA_CTRL_003",
      "study_family_id": "gill_2022",
      "source_kind": "study_specific_rule",
      "trust_status": "rule_backed_with_bounded_manual_judgment",
      "traceable_support": {
        "study_family_id": "gill_2022",
        "accession_bundle": "GSE165180",
        "derived_from": [
          "repo:/programs/partial-reprogramming-controller/benchmarks/phase-stratified-controller-benchmark-v0/compiler-rules/gill_2022-v0.json",
          "repo:/programs/partial-reprogramming-controller/benchmarks/phase-stratified-controller-benchmark-v0/controller-benchmark-study-corpus-v0.csv",
          "repo:/programs/partial-reprogramming-controller/benchmarks/phase-stratified-controller-benchmark-v0/controller-benchmark-negative-family-registry-v0.json"
        ]
      },
      "bounded_manual_judgment_fields": [
        "phase_layer",
        "evidence_modes_present",
        "age_signal_score",
        "identity_pressure_level",
        "risk_pressure_level",
        "active_negative_family_ids",
        "condition_summary"
      ],
      "derived_fields": [
        "primary_evidence_class",
        "supporting_evidence_classes",
        "age_signal_status",
        "identity_status",
        "risk_status",
        "negative_family_roles",
        "negative_family_tiers",
        "source_trace",
        "provenance"
      ],
      "matrix_extracted_fields": [],
      "compiler_trust_notes": [
        "This condition is now carried by a dedicated study-specific rule pack rather than the global fixture.",
        "The benchmark decision fields remain bounded human judgments encoded in the rule pack rather than direct matrix-derived extraction outputs."
      ],
      "condition_summary": "Gill successful maturation branch with real later-phase timing and relatively favorable proxy identity profile."
    },
    {
      "condition_id": "VITA_CTRL_004",
      "study_family_id": "gill_2022",
      "source_kind": "study_specific_rule",
      "trust_status": "rule_backed_with_bounded_manual_judgment",
      "traceable_support": {
        "study_family_id": "gill_2022",
        "accession_bundle": "GSE165180",
        "derived_from": [
          "repo:/programs/partial-reprogramming-controller/benchmarks/phase-stratified-controller-benchmark-v0/compiler-rules/gill_2022-v0.json",
          "repo:/programs/partial-reprogramming-controller/benchmarks/phase-stratified-controller-benchmark-v0/controller-benchmark-study-corpus-v0.csv",
          "repo:/programs/partial-reprogramming-controller/benchmarks/phase-stratified-controller-benchmark-v0/controller-benchmark-negative-family-registry-v0.json"
        ]
      },
      "bounded_manual_judgment_fields": [
        "phase_layer",
        "evidence_modes_present",
        "age_signal_score",
        "identity_pressure_level",
        "risk_pressure_level",
        "active_negative_family_ids",
        "condition_summary"
      ],
      "derived_fields": [
        "primary_evidence_class",
        "supporting_evidence_classes",
        "age_signal_status",
        "identity_status",
        "risk_status",
        "negative_family_roles",
        "negative_family_tiers",
        "source_trace",
        "provenance"
      ],
      "matrix_extracted_fields": [],
      "compiler_trust_notes": [
        "This condition is now carried by a dedicated study-specific rule pack rather than the global fixture.",